{"A_Pi":{"case:0a4d7152004aa6215f57":{"evaluator_truth_ref":"artifact:0e530eed98e1f3ad9d2f#L285","expected_realm":"realm-b","kind":"AUTHORIZATION_INPUT_CERTIFICATE"},"case:7e1f9f910973f4196bb8":{"evaluator_truth_ref":"artifact:349921bab3faee979455#L125","expected_realm":"test-realm","kind":"AUTHORIZATION_INPUT_CERTIFICATE"},"case:906ed0caa75d4067918d":{"evaluator_truth_ref":"artifact:349921bab3faee979455#L225","expected_realm":"prod-realm","kind":"AUTHORIZATION_INPUT_CERTIFICATE"},"case:aa50750cd1fc52dc9f56":{"evaluator_truth_ref":"artifact:349921bab3faee979455#L376","expected_realm":"analytics-realm","kind":"AUTHORIZATION_INPUT_CERTIFICATE"},"case:bc4db6fc3b742b39f763":{"evaluator_truth_ref":"artifact:349921bab3faee979455#L752","expected_realm":"catalog-realm","kind":"AUTHORIZATION_INPUT_CERTIFICATE"},"case:ca9fa12876555b9cb025":{"evaluator_truth_ref":"artifact:0e530eed98e1f3ad9d2f#L230","expected_realm":"factory-realm","kind":"AUTHORIZATION_INPUT_CERTIFICATE"},"case:e034f27f2bbfbf3b6a1f":{"evaluator_truth_ref":"artifact:349921bab3faee979455#L1141","expected_realm":"explicit-realm","kind":"AUTHORIZATION_INPUT_CERTIFICATE"},"case:e3e390037ac4ad9ad277":{"evaluator_truth_ref":"artifact:349921bab3faee979455#L1174","expected_realm":"tenant-xyz","kind":"AUTHORIZATION_INPUT_CERTIFICATE"}},"H":{"admitted_artifact_ids":["artifact:0b59d0c962df13802562","artifact:0c484a11b8d4ec906875","artifact:0e530eed98e1f3ad9d2f","artifact:1818eb44031f5dc4719f","artifact:2ef9d4704ba1b42378a7","artifact:349921bab3faee979455","artifact:360de0be5aabeb76b355","artifact:3b9168154787cc539e6a","artifact:4f390ae247cb149b7abe","artifact:58d0f6c1b1baa90dceb5","artifact:765bd07bca2879bb3eef","artifact:7b98a32cb4ec015c730f","artifact:7bcdf0bbc7451b9af21b","artifact:849b81356b83490b91e7","artifact:911252956e9611e9606b","artifact:98afd169fbb99d63989a","artifact:9a6dcd81b2ca6e434f01","artifact:a2626726527393ff6506","artifact:b7249f62e1d14d4d968d","artifact:bcb65022c11210147a3a","artifact:c024d55c84c380794377","artifact:c61d6ed49561ff1d1fe2","artifact:ccddc5944de626337ad8","artifact:dbb00741394b5c008663"],"existing_artifact_ids":["artifact:0b59d0c962df13802562","artifact:0c484a11b8d4ec906875","artifact:0e530eed98e1f3ad9d2f","artifact:1818eb44031f5dc4719f","artifact:2ef9d4704ba1b42378a7","artifact:349921bab3faee979455","artifact:360de0be5aabeb76b355","artifact:3b9168154787cc539e6a","artifact:4f390ae247cb149b7abe","artifact:58d0f6c1b1baa90dceb5","artifact:60459e8eccc6acd55ee6","artifact:765bd07bca2879bb3eef","artifact:7b98a32cb4ec015c730f","artifact:7bcdf0bbc7451b9af21b","artifact:849b81356b83490b91e7","artifact:911252956e9611e9606b","artifact:98afd169fbb99d63989a","artifact:9a6dcd81b2ca6e434f01","artifact:a2626726527393ff6506","artifact:b7249f62e1d14d4d968d","artifact:bcb65022c11210147a3a","artifact:c024d55c84c380794377","artifact:c61d6ed49561ff1d1fe2","artifact:ccddc5944de626337ad8","artifact:dbb00741394b5c008663","artifact:eccc384374fb60c65a18"],"normalization":"stable artifact identity; existence and admission are separate"},"Lambda":{"state:polaris_opa_post_repair_context_with_realm_certificate":{"authority_hash":"4e829495f03ddea3326dd9e22f9c302e309172ee60ec6e494f28a2576bf16528","entries":[{"admissible":true,"identifier":"opa_boolean_decision_response","kind":"ATTESTATION","provenance_fact_ids":["fact:614fb5aec263563494df","fact:e99b1e2429617a0d1a59"]},{"admissible":true,"identifier":"default_deny_then_explicit_allow","kind":"CHECK","provenance_fact_ids":["fact:614fb5aec263563494df","fact:e99b1e2429617a0d1a59"]},{"admissible":true,"identifier":"all_fields_presented_in_opa_input","kind":"FIELD","provenance_fact_ids":["fact:614fb5aec263563494df","fact:e99b1e2429617a0d1a59"]},{"admissible":true,"identifier":"rego_allow_over_presented_input","kind":"PREDICATE","provenance_fact_ids":["fact:614fb5aec263563494df","fact:e99b1e2429617a0d1a59"]},{"admissible":true,"identifier":"configured_opa_policy_endpoint","kind":"SOURCE","provenance_fact_ids":["fact:614fb5aec263563494df","fact:e99b1e2429617a0d1a59"]}]},"state:polaris_opa_pre_repair_context_without_realm_certificate":{"authority_hash":"4e829495f03ddea3326dd9e22f9c302e309172ee60ec6e494f28a2576bf16528","entries":[{"admissible":true,"identifier":"opa_boolean_decision_response","kind":"ATTESTATION","provenance_fact_ids":["fact:614fb5aec263563494df","fact:e99b1e2429617a0d1a59"]},{"admissible":true,"identifier":"default_deny_then_explicit_allow","kind":"CHECK","provenance_fact_ids":["fact:614fb5aec263563494df","fact:e99b1e2429617a0d1a59"]},{"admissible":true,"identifier":"all_fields_presented_in_opa_input","kind":"FIELD","provenance_fact_ids":["fact:614fb5aec263563494df","fact:e99b1e2429617a0d1a59"]},{"admissible":true,"identifier":"rego_allow_over_presented_input","kind":"PREDICATE","provenance_fact_ids":["fact:614fb5aec263563494df","fact:e99b1e2429617a0d1a59"]},{"admissible":true,"identifier":"configured_opa_policy_endpoint","kind":"SOURCE","provenance_fact_ids":["fact:614fb5aec263563494df","fact:e99b1e2429617a0d1a59"]}]}},"P_R":{"state:polaris_opa_post_repair_context_with_realm_certificate":{"blocks":[["history:0455ce58a072ff270a52"],["history:3c0b86c4048477d1b19b"],["history:4371cb0d18d62b5e7bd0"],["history:56e07a8253c7fed15cea"],["history:586002bea96d23f7cecd"],["history:99a8b53740046b40dccb"],["history:b69efed26e2c2839b2d9"],["history:c7d531a10e7cbf6361dd"]],"history_domain":["history:0455ce58a072ff270a52","history:3c0b86c4048477d1b19b","history:4371cb0d18d62b5e7bd0","history:56e07a8253c7fed15cea","history:586002bea96d23f7cecd","history:99a8b53740046b40dccb","history:b69efed26e2c2839b2d9","history:c7d531a10e7cbf6361dd"],"partition_hash":"dc130500bd1a77a0636cef77165665a19e7184457837b4ce94c505d46ae52a1c"},"state:polaris_opa_pre_repair_context_without_realm_certificate":{"blocks":[["history:0455ce58a072ff270a52","history:3c0b86c4048477d1b19b","history:4371cb0d18d62b5e7bd0","history:56e07a8253c7fed15cea","history:586002bea96d23f7cecd","history:99a8b53740046b40dccb","history:b69efed26e2c2839b2d9","history:c7d531a10e7cbf6361dd"]],"history_domain":["history:0455ce58a072ff270a52","history:3c0b86c4048477d1b19b","history:4371cb0d18d62b5e7bd0","history:56e07a8253c7fed15cea","history:586002bea96d23f7cecd","history:99a8b53740046b40dccb","history:b69efed26e2c2839b2d9","history:c7d531a10e7cbf6361dd"],"partition_hash":"34c74571899818058cdf6f847a2b9b85bdc049e771a88eef554d89fb361a8643"}},"Q":[{"atomicity":{"basis":"single historical PR changes interface, factory injection, and emitted context","is_atomic":true},"cost":{"native":null,"unit":1},"intervention_id":"action:historical_context_realm_injection","positive_support_successors":[{"state_id":"state:polaris_opa_post_repair_context_with_realm_certificate","support":1}],"preconditions":["OPA authorizer selected","realm context resolvable"],"provenance_fact_ids":["fact:2590ad29148cc63349cb","fact:affda6f8ed9683d4cabc","fact:fb192983aa91bcce5ef3"],"public_effect":"add required realm certificate to the existing OPA request path","source_state_id":"state:polaris_opa_pre_repair_context_without_realm_certificate"}],"S":["state:polaris_opa_pre_repair_context_without_realm_certificate","state:polaris_opa_post_repair_context_with_realm_certificate"],"Succ_plus":{"action:historical_context_realm_injection":["state:polaris_opa_post_repair_context_with_realm_certificate"]},"Terminal":{"case:0a4d7152004aa6215f57":{"post_satisfied":true,"pre_satisfied":false,"predicate":"input.context.realm == injected RealmContext identifier","provenance_fact_ids":["fact:1f273cba76a7102a6e58","fact:24eded3db97f6ce0f9b7","fact:65a765380f3a97ef7b2b","fact:6900c2b7e98c872ebf8a","fact:815b6fd66aba8f7ad12d","fact:9e45764de0817198c90e","fact:bf579ccde1d5a09fee13","fact:ffa05b1ae36f6316a2a5"],"target_class":"AUTHORIZATION_INPUT_CERTIFICATE"},"case:7e1f9f910973f4196bb8":{"post_satisfied":true,"pre_satisfied":false,"predicate":"input.context.realm == injected RealmContext identifier","provenance_fact_ids":["fact:1f273cba76a7102a6e58","fact:24eded3db97f6ce0f9b7","fact:65a765380f3a97ef7b2b","fact:6900c2b7e98c872ebf8a","fact:815b6fd66aba8f7ad12d","fact:9e45764de0817198c90e","fact:bf579ccde1d5a09fee13","fact:ffa05b1ae36f6316a2a5"],"target_class":"AUTHORIZATION_INPUT_CERTIFICATE"},"case:906ed0caa75d4067918d":{"post_satisfied":true,"pre_satisfied":false,"predicate":"input.context.realm == injected RealmContext identifier","provenance_fact_ids":["fact:1f273cba76a7102a6e58","fact:24eded3db97f6ce0f9b7","fact:65a765380f3a97ef7b2b","fact:6900c2b7e98c872ebf8a","fact:815b6fd66aba8f7ad12d","fact:9e45764de0817198c90e","fact:bf579ccde1d5a09fee13","fact:ffa05b1ae36f6316a2a5"],"target_class":"AUTHORIZATION_INPUT_CERTIFICATE"},"case:aa50750cd1fc52dc9f56":{"post_satisfied":true,"pre_satisfied":false,"predicate":"input.context.realm == injected RealmContext identifier","provenance_fact_ids":["fact:1f273cba76a7102a6e58","fact:24eded3db97f6ce0f9b7","fact:65a765380f3a97ef7b2b","fact:6900c2b7e98c872ebf8a","fact:815b6fd66aba8f7ad12d","fact:9e45764de0817198c90e","fact:bf579ccde1d5a09fee13","fact:ffa05b1ae36f6316a2a5"],"target_class":"AUTHORIZATION_INPUT_CERTIFICATE"},"case:bc4db6fc3b742b39f763":{"post_satisfied":true,"pre_satisfied":false,"predicate":"input.context.realm == injected RealmContext identifier","provenance_fact_ids":["fact:1f273cba76a7102a6e58","fact:24eded3db97f6ce0f9b7","fact:65a765380f3a97ef7b2b","fact:6900c2b7e98c872ebf8a","fact:815b6fd66aba8f7ad12d","fact:9e45764de0817198c90e","fact:bf579ccde1d5a09fee13","fact:ffa05b1ae36f6316a2a5"],"target_class":"AUTHORIZATION_INPUT_CERTIFICATE"},"case:ca9fa12876555b9cb025":{"post_satisfied":true,"pre_satisfied":false,"predicate":"input.context.realm == injected RealmContext identifier","provenance_fact_ids":["fact:1f273cba76a7102a6e58","fact:24eded3db97f6ce0f9b7","fact:65a765380f3a97ef7b2b","fact:6900c2b7e98c872ebf8a","fact:815b6fd66aba8f7ad12d","fact:9e45764de0817198c90e","fact:bf579ccde1d5a09fee13","fact:ffa05b1ae36f6316a2a5"],"target_class":"AUTHORIZATION_INPUT_CERTIFICATE"},"